Document;Date;clean_sentence;Source;Recipient_Code;Recipient_Name;aid_type;recipient_type;Note
TİKA-Stratejik-Plan-2018-2022.pdf;2018;"Başkanlığımız bünyesinde, ikili işbirliği anlaşmaları veya mutabakat muhtıraları çerçevesinde hâlihazırda 58 ülkede 60 PKO [Afganistan Kabil, Afganistan Mezar-ı Şerif, Afganistan Herat, Arnavutluk, Azerbaycan, Bangladeş, Bosna Hersek, Tabi Personel 657 sayılı Kanuna Sözleşmeli Personel Geçici Personel Şirket Personeli Güvenlik Hizmetleri Yerel Personel (Temizlik+Vasıflı) Cezayir, Cibuti, Çad, Etiyopya, Filipinler, Filistin, Gine, Güney Afrika Cumhuriyeti, Güney Sudan, Gürcistan, Hırvatistan, Irak, Kamerun, Karadağ, Kazakistan, Kenya, Kırgızistan, Kolombiya, Komorlar Birliği, Kosova, Libya, Lübnan, Macaristan, Makedonya, Meksika, Mısır, Moğolistan, Moldova, Mozambik, Myanmar, Namibya, Nijer, Özbekistan, Pakistan, Romanya, Senegal, Sırbistan, Somali, Sudan, Suriye (ülkenin içerisinde bulunduğu özel şartlar sebebiyle hâlihazırda aktif değil), Tacikistan, Tanzanya, Tunus, Türkmenistan, Uganda, Ukrayna Kırım, Ukrayna Kiev, Toplam: 797 Ürdün, Yemen] ve 6 İrtibat Ofisi; (Filistin Gazze, Yemen Aden, Somali Hargeisa, Libya Bingazi (aktif değil), Sudan Nyala (aktif değil), Kazakistan Almatı) bulunmaktadır.";;347;Kosova;;Belirsiz;Drop
TİKA-Stratejik-Plan-2018-2022.pdf;2018;"Başkanlığımız bünyesinde, ikili işbirliği anlaşmaları veya mutabakat muhtıraları çerçevesinde hâlihazırda 58 ülkede 60 PKO [Afganistan Kabil, Afganistan Mezar-ı Şerif, Afganistan Herat, Arnavutluk, Azerbaycan, Bangladeş, Bosna Hersek, Tabi Personel 657 sayılı Kanuna Sözleşmeli Personel Geçici Personel Şirket Personeli Güvenlik Hizmetleri Yerel Personel (Temizlik+Vasıflı) Cezayir, Cibuti, Çad, Etiyopya, Filipinler, Filistin, Gine, Güney Afrika Cumhuriyeti, Güney Sudan, Gürcistan, Hırvatistan, Irak, Kamerun, Karadağ, Kazakistan, Kenya, Kırgızistan, Kolombiya, Komorlar Birliği, Kosova, Libya, Lübnan, Macaristan, Makedonya, Meksika, Mısır, Moğolistan, Moldova, Mozambik, Myanmar, Namibya, Nijer, Özbekistan, Pakistan, Romanya, Senegal, Sırbistan, Somali, Sudan, Suriye (ülkenin içerisinde bulunduğu özel şartlar sebebiyle hâlihazırda aktif değil), Tacikistan, Tanzanya, Tunus, Türkmenistan, Uganda, Ukrayna Kırım, Ukrayna Kiev, Toplam: 797 Ürdün, Yemen] ve 6 İrtibat Ofisi; (Filistin Gazze, Yemen Aden, Somali Hargeisa, Libya Bingazi (aktif değil), Sudan Nyala (aktif değil), Kazakistan Almatı) bulunmaktadır.";;343;Makedonya;;Belirsiz;Drop
TİKA-Stratejik-Plan-2018-2022.pdf;2018;Kosova, Makedonya, Moldova, Özbekistan, Somali, Sudan, Tacikistan, Türkmenistan, Ukrayna.;;347;Kosova;;Belirsiz;Drop
TİKA-Stratejik-Plan-2018-2022.pdf;2018;Kosova, Makedonya, Moldova, Özbekistan, Somali, Sudan, Tacikistan, Türkmenistan, Ukrayna.;;343;Makedonya;;Belirsiz;Drop
TIKAFaaliyet2019WebKapakli.pdf;2019;"TİKA tarafından Kosova’nın Gilan şehrindeki Musa Zajmi
İlköğretim Okulunun okul öncesi sınıfları yenilenerek
donatım desteği sağlanmıştır. Proje sayesinde çocuklar
kaliteli bir eğitim ortamına kavuşmuştur.";Tika;347;Kosova;Eğitim ve Kültürel Yardımlar;Sivil Toplum;
TIKAFaaliyet2019WebKapakli.pdf;2019;[Afganistan Kabil, Afganistan Mezar-ı Şerif, Arnavutluk, Azerbaycan, Bangladeş, Bosna Hizmet binamız yaklaşık 30.000 m kullanım alanı, yaklaşık 100 araçlık kapalı otopark, 2 Hersek, Bulgaristan [kurulma aşamasında], Cezayir, Cibuti, Çad, Etiyopya, Filipinler, Filis- 4 asansör, 420 kişilik yemekhaneye sahip olup, 1984 yılından beri hizmet vermektedir.;;355;Bulgaristan;İnsani Yardım;Belirsiz;Drop
TIKAFaaliyet2019WebKapakli.pdf;2019;tistan, Irak, İsrail [kurulma aşamasında], Kamerun, Karadağ, Kazakistan, Kenya, Kırgızis- tan, Kolombiya, Komorlar Birliği, Kosova, Kuzey Kıbrıs Türk Cumhuriyeti, Libya, Lübnan, Başkanlığımızda 13 adet resmi plakalı araç hizmet vermektedir.;;347;Kosova;;Merkezi Hükümet ve Bağlı Aktörler;Drop
TIKAFaaliyet2019WebKapakli.pdf;2019;Merkez hizmet binası Macaristan, Madagaskar, Kuzey Makedonya, Mali [kurulma aşamasında], Meksika, Mısır, ve araçlar Kurum faaliyetlerinin mevcut şartlarda yerine getirilmesi için yeterli olmakla Moğolistan, Moldova, Mozambik, Myanmar, Namibya, Nijer, Nijerya [kurulma aşamasın- birlikte yurtdışındaki ofislerimizin sayısının sürekli artıyor olması kiralık hizmet binası ve da], Özbekistan, Pakistan, Romanya, Senegal, Sırbistan, Somali, Sudan, Suriye [ülkenin arazi aracı ihtiyacını beraberinde getirmektedir.;;343;Makedonya;;Belirsiz;Drop
TIKAFaaliyet2019WebKapakli.pdf;2019;| Ankara | Kosova [Arıcılığa Destek] TİKA Faaliyet Raporu | 2019 22 TİKA Faaliyet Raporu | 2019 23 PROGRAM KOORDİNASYON OFİSLERİ LİSTESİ | 01 PROGRAM KOORDİNASYON OFİSLERİ LİSTESİ | 02 TİKA PKO LİSTESİ TİKA PKO LİSTESİ ÜLKE PKO ÜLKE PKO 1 KIRGIZİSTAN Bişkek PKO Beyrut PKO 27 LÜBNAN 2 TÜRKMENİSTAN Aşkabat PKO Trablus İO 3 AZERBAYCAN Bakü PKO Trablus PKO / 28 LİBYA Bingazi İO [Aktif Değil] 4 ÖZBEKİSTAN Taşkent PKO 29 SOMALİ Mogadişu PKO / Hargeisa İO 5 MOLDOVA Kişinev PKO 30 TUNUS Tunus PKO 6 GÜRCİSTAN Tiflis PKO 31 KENYA Nairobi PKO 7 KAZAKİSTAN Nursultan PKO / Almatı İO 32 YEMEN Sanaa PKO / Aden İO 8 BOSNA HERSEK Saraybosna PKO 33 MYANMAR Yangon PKO 9 UKRAYNA Kırım PKO 34 NİJER Niamey PKO 10 UKRAYNA Kiev PKO 35 GÜNEY SUDAN Juba PKO 11 TACİKİSTAN Duşanbe PKO 36 ÜRDÜN Amman PKO 12 MOĞOLİSTAN UlanBator PKO 37 BANGLADEŞ Dakka PKO 13 ARNAVUTLUK Tiran PKO 38 KAMERUN Yaunde PKO Kabil PKO 14 AFGANİSTAN Herat İO 39 MACARİSTAN Budapeşte PKO 15 KOSOVA Priştine PKO 40 NAMİBYA Windhoek PKO 16 ETYOPYA Addis Ababa PKO 41 FİLİPİNLER Manila PKO Kudüs PKO 42 CEZAYİR Cezayir PKO 17 FİLİSTİN Gazze İO Sofya PKO 43 BULGARİSTAN 18 KUZEY MAKEDONYA Üsküp PKO [Kurulma Aşamasında] Hartum PKO 44 KOMOR ADALARI Moroni PKO 19 SUDAN Nyala İO [Aktif Değil] 45 ROMANYA Bükreş PKO 20 AFGANİSTAN Mezar-ı Şerif PKO 46 TANZANYA Darüsselam PKO 21 SENEGAL Dakar PKO 47 ÇAD Encemine PKO 22 KARADAĞ Podgoritsa PKO 48 MEKSİKA Meksika Şehri PKO 23 SURİYE Şam PKO [Aktif Değil] 49 CİBUTİ Cibuti PKO İslamabad PKO 24 PAKİSTAN 50 KOLOMBİYA Bogota PKO Karaçi İO 25 SIRBİSTAN Belgrad PKO 51 IRAK Bağdat PKO 26 MISIR Kahire PKO 52 HIRVATİSTAN Zagreb PKO TİKA Faaliyet Raporu | 2019 24 TİKA Faaliyet Raporu | 2019 25 PROGRAM KOORDİNASYON OFİSLERİ LİSTESİ | 03 2.;;347;Kosova;İnsani Yardım;Belirsiz;Drop
TIKAFaaliyet2019WebKapakli.pdf;2019;Ofisler ile İletişim Başkanlığımız Program Koordinasyon Ofisleri ile daha ekonomik, kolay ve güvenli ileti- şim için 2006 yılında uydu bağlantısı üzerinden telefon ve internet projesi başlatılmış olup uydu üzerinden internet sağlanan ofisler şu şekildedir: Afganistan, Arnavutluk, Azerbaycan, Bosna-Hersek, Filistin, Gürcistan, Karadağ, Kazakistan, Kosova, Kuzey Ma- kedonya, Moldova, Özbekistan, Sudan, Tacikistan, Türkmenistan 5.;;347;Kosova;Ekonomik, Kalkınma, Teknik ve Altyapı Yardımı;Belirsiz;Drop
TIKAFaaliyet2019WebKapakli.pdf;2019;Dostluk Okulu ve Dostluk Parkı | Nijer Kuzey Kuzey Makedonya İslam Dini Birliği Başkanlığına bağlı olarak eğitim veren Üsküp İsa Makedonya, Bey Medresesi, Osmanlı Devleti döneminde ‘’Üsküp Medresesi’’ adıyla kurulmuş olan İslam Dini Birliği ve faaliyetlerinde zaman zaman duraksamalar yaşanmış olan İsa Bey Medresesi, 1984 İsa Bey Medresesi yılından beri eğitim faaliyetlerini Üsküp yakınlarındaki Kondova Köyü’nde sürdürmekte- Yurt Binası dir.;;343;Makedonya;;Belirsiz;Drop
TIKAFaaliyet2019WebKapakli.pdf;2019;Kuzey Makedonya İslam Dini Birliği Başkanlığı’na bağlı ola- rak eğitim veren medresenin yurt binasının modernizasyonu ve donatımı Başkanlığımız Yurt Binası Modernizasyonu tarafından gerçekleştirilmiştir.;Tika;343;Makedonya;Eğitim ve Kültürel Yardımlar;Sivil Toplum;
TIKAFaaliyet2019WebKapakli.pdf;2019;"Azerbaycan, Kırgızistan, Türkmenistan, Gürcistan, Özbekistan, Romanya, Kosova ülkelerinde bulunan soydaşlarımızın
çocuklarının eğitimi için 260.000 üzerinde eğitim malzeme yardımı ile 165.000 üzerinde kültür kitabı hibesi
edilmiştir.";Tika;347;Kosova;Eğitim ve Kültürel Yardımlar;Sivil Toplum;
TIKAFaaliyet2019WebKapakli.pdf;2019;"Sağlık Bakanlığı tarafından; sağlık alanındaki İkili anlaşmalar kapsamında, 2019 yılında Suriye, Irak, Afganistan,
Sudan, Yemen, Kosova, Azerbaycan, Arnavutluk, Nijer, Kırgızistan başta olmak üzere çeşitli ülke vatandaşlarından
yıllık ortalama 1.500 civarı hastaya ücretsiz sağlık hizmeti sunulmuştur.";Tika;347;Kosova;İnsani Yardım;Sivil Toplum;
TIKAFaaliyet2019WebKapakli.pdf;2019;Kosova-Prizren Namazgâh bakım onarım projesi gerçekleştirilmiştir.;Tika;347;Kosova;Eğitim ve Kültürel Yardımlar;Yerel Yönetimler;
TIKAFaaliyet2019WebKapakli.pdf;2019;Kosova-Ferizay Deshmoret Koshare İlköğretim Okulu bakım onarım ve malzeme alımı yapılmıştır.;Tika;347;Kosova;Eğitim ve Kültürel Yardımlar;Sivil Toplum;
TIKAFaaliyet2019WebKapakli.pdf;2019;"Kosova - Priştina Piri Nazır [Pirinaz] Camii, Priştina Alaaddin Bey Camii, Cakova Mahmud Paşa Camii, Surigana
Köyü Camii, Cakova Rahaveç Kuran Kursu için restorasyon çalışmaları başlatılmıştır. Bölge halkı açısından kültürel
mirasın sembolü olarak görülen yapılar, sadece Kosovalıların değil dünyanın dört bir yanından gelen Türklerin
ve turistlerin önemli bir ziyaret noktasıdır.";Tika;347;Kosova;Eğitim ve Kültürel Yardımlar;Sivil Toplum;
TIKAFaaliyet2019WebKapakli.pdf;2019;"Afganistan, Bangladeş, Benin, Bosna-Hersek, Burundi, Burkina Faso, Çad, Endonezya, Etiyopya, Fildişi Sahili,Filipinler,
Filistin, Gana, Kamerun, Kenya, Kosova, Kuzey Makedonya, Lübnan, Mali, Moğolistan, Moritanya, Nijer,
Sierra Leone, Sri Lanka, Tanzanya, Tayland, Uganda, Yemen’de bulunan yetimlere ve yetimhanelere nakdi, gıda
ve çeşitli malzeme desteğinde bulunulmuştur.";Tika;347;Kosova;İnsani Yardım;Sivil Toplum;
TIKAFaaliyet2019WebKapakli.pdf;2019;"TİKA tarafından Kuzey Makedonya’nın güneydoğusundaki Valandova şehrinde yeni okul binası
inşa edilmiştir. Kızıldoğan [Kazandol] Köyü’nde inşa edilen, Valandova “Tsvetan Dimov” İlköğretim
Okuluna bağlı köy okulunun eğitim binası tamamlanmıştır. 28 öğrencinin eğitim göreceği
yeni okul binasında üç derslik ve bir öğretmenler odası bulunmaktadır.";Tika;343;Makedonya;Eğitim ve Kültürel Yardımlar;Sivil Toplum;
TIKAFaaliyet2019WebKapakli.pdf;2019;Kuzey Makedonya’da eğitim gören 2.000 soydaş öğrencimizin çanta ve kırtasiye ihtiyaçları karşılanmıştır.;Tika;343;Makedonya;Eğitim ve Kültürel Yardımlar;Sivil Toplum;
TIKAFaaliyet2019WebKapakli.pdf;2019;"orka Taleski Devlet Hastanesi 2019 yılında yaklaşık
olarak 9.921 hastaya yataklı, toplam 232.704 hastaya
ise ayakta tedavi hizmeti vermiştir. Belirtilen hasta
sayısından 600’den fazlası ambulans ile farklı sağlık
birimlerine ve merkezine nakledilmiştir. Hali hazırda
hastanede mevcut 3 adet ambulanstan 2 tanesi eski
ve kullanılamaz halde olup, durmadan arıza vermektedir.
Ancak, ülkedeki olumsuz ekonomik şartlar nedeniyle
eskiyen ambulansların yenilerinin temin edilmesinde
yaşanan sıkıntılar hastanenin hizmetlerinde
aksamalara neden olmaktadır. Devlet Hastanesi’nin
daha sağlıklı ve kaliteli hizmet verebilmesi için ihtiyaçları
olan bir adet acil yardım ambulans aracı TİKA tarafından
hibe edilmiştir.";Tika;343;Makedonya;İnsani Yardım;Merkezi Hükümet ve Bağlı Aktörler;
TIKAFaaliyet2019WebKapakli.pdf;2019;"Kuzey Makedonya Cumhuriyeti Dışişleri Bakanlığının
teknik altyapısının iyileştirilmesi
kapsamında TİKA tarafından dijital arşiv altyapısının
kurulumu için gerekli 3 adet masaüstü
bilgisayar, 2 adet renkli çok fonksiyonlu
yazıcı, 5 adet tarayıcı, 1 adet arşiv depolama
cihazı, 1 adet server ve 1 adet gelişmiş yazılım
temin edilmiş ve kurulumu yapılarak gerekli
eğitim desteği sağlanmıştır. Dijital arşiv altyapısının
kurulumu projesinin, Kuzey Makedonya
arşivlerinin araştırma maksatlı tasnifi
hususunda önemli";Tika;343;Makedonya;Ekonomik, Kalkınma, Teknik ve Altyapı Yardımı;Merkezi Hükümet ve Bağlı Aktörler;
TIKAFaaliyet2019WebKapakli.pdf;2019;"Kuzey Makedonya Sveti Nikole Belediyesinde yapımı planlanan cami inşaatı, Zimbabve’da Gara Warima Waqf
Foundation’un [GWWF] yarım halde bulunan cami inşaatları, Ukrayna Kiev Çayki Köyünde yapılmakta olan İslam
Kültür Merkezi inşaatına yardım gönderilmiştir.";Tika;343;Makedonya;Eğitim ve Kültürel Yardımlar;Yerel Yönetimler;
TIKAFaaliyet2019WebKapakli.pdf;2019;Camii Restorasyonu Kuzey Makedonya Kuzey Fatih Sultan Mehmet’in babası Sultan II.;Tika;343;Makedonya;;Belirsiz;Drop
TIKAFaaliyet2019WebKapakli.pdf;2019;"Vakfiyelerde yer alan hayır şartlarının yerine getirilmesi amacıyla Bosna-Hersek, Kuzey Kıbrıs Türk Cumhuriyeti,
Kuzey Makedonya ve Yemen’de bulunan ihtiyaç sahiplerine gıda yardımları gönderilmiştir.";Tika;343;Makedonya;İnsani Yardım;Sivil Toplum;
TIKAFaaliyet2019WebKapakli.pdf;2019;"Afganistan, Bangladeş, Benin, Bosna-Hersek, Burundi, Burkina Faso, Çad, Endonezya, Etiyopya, Fildişi Sahili,Filipinler,
Filistin, Gana, Kamerun, Kenya, Kosova, Kuzey Makedonya, Lübnan, Mali, Moğolistan, Moritanya, Nijer,
Sierra Leone, Sri Lanka, Tanzanya, Tayland, Uganda, Yemen’de bulunan yetimlere ve yetimhanelere nakdi, gıda
ve çeşitli malzeme desteğinde bulunulmuştur.";Tika;343;Makedonya;İnsani Yardım;Sivil Toplum;
TIKAFaaliyet2019WebKapakli.pdf;2019;"Murad tarafından 1436 yılında Üsküp’te inşa Makedonya, edilmiş olan Sultan Murad Camisi, Türkiye toprakları dışında olup, varlığını sürdüren Üsküp Sultan ibadete açık tek “sultan camisidir.” Murad Camii Restorasyonu Üsküp’te şehir merkezine hakim bir tepede yer alan külliye; cami, medrese, mektep ve imaret yapılarından meydana gelmektedir.";;343;Makedonya;Eğitim ve Kültürel Yardımlar;Belirsiz;Drop
TIKAFaaliyet2019WebKapakli.pdf;2019;| Kuzey Makedonya | [Sultan Murad Camii] TİKA Faaliyet Raporu | 2019 112 TİKA Faaliyet Raporu | 2019 113 Azerbaycan, Milli Yayla Festivali, Türk kültürünün önemli zenginliklerinden olan yayla ve göçebe kül- Ukrayna, Toplam nüfusu yaklaşık 32.000 olan Ukrayna’daki Gagavuz Türkleri, Ukrayna’nın çeşitli Milli Yayla türünün Azerbaycan’da yaşatılması ve tanıtılmasına katkı sağlanması ve Azerbaycan’da Gagavuz Kültür yerleşimlerinde toplu olarak yaşamaktadır.;;343;Makedonya;İnsani Yardım;Belirsiz;Drop
TIKAFaaliyet2019WebKapakli.pdf;2019;Bulgaristan Madan Bölge Hastanesi için dijital röntgen cihazı alımı yapılmıştır.;Tika ;355;Bulgaristan;Ekonomik, Kalkınma, Teknik ve Altyapı Yardımı;Yerel Yönetimler;
TIKAFaaliyet2020Web.pdf;2020;Ankara TİKA PROGRAM KOORDİNASYON OFİSLERİ Başkanlığımız, yurt dışında yürüteceği işbirliği faaliyet- Güney Afrika, Güney Sudan, Gürcistan, Hırvatistan, Irak, lerinin gerektirdiği koordinasyonu sağlamak amacıyla, İsrail[kurulma aşamasında], Kamerun, Karadağ, Kaza- görev alanına giren ve önceliği olan bölge ülkelerinde, kistan, Kenya, Kırgızistan, Kolombiya, Komorlar Birliği, Dışişleri Bakanlığı ile gerekli koordinasyonu sağlayıp, Kosova, Kuzey Kıbrıs Türk Cumhuriyeti, Libya, Lübnan, görüşlerini almak sureti ile Program Koordinasyon Ofis- Macaristan, Madagaskar, Makedonya, Mali [kurulma leri açmaktadır.;;347;Kosova;;Belirsiz;Drop
TIKAFaaliyet2020Web.pdf;2020;Ankara TİKA PROGRAM KOORDİNASYON OFİSLERİ Başkanlığımız, yurt dışında yürüteceği işbirliği faaliyet- Güney Afrika, Güney Sudan, Gürcistan, Hırvatistan, Irak, lerinin gerektirdiği koordinasyonu sağlamak amacıyla, İsrail[kurulma aşamasında], Kamerun, Karadağ, Kaza- görev alanına giren ve önceliği olan bölge ülkelerinde, kistan, Kenya, Kırgızistan, Kolombiya, Komorlar Birliği, Dışişleri Bakanlığı ile gerekli koordinasyonu sağlayıp, Kosova, Kuzey Kıbrıs Türk Cumhuriyeti, Libya, Lübnan, görüşlerini almak sureti ile Program Koordinasyon Ofis- Macaristan, Madagaskar, Makedonya, Mali [kurulma leri açmaktadır.;;343;Makedonya;;Belirsiz;Drop
TIKAFaaliyet2020Web.pdf;2020;"Başkanlığımız bünyesinde, ikili işbirliği aşamasında],Meksika, Mısır, Moğolistan, Moldova, Mo- anlaşmaları veya mutabakat muhtıraları çerçevesinde zambik, Myanmar, Namibya, Nijer, Nijerya [kurulma aşa- hâlihazırda 60 ülkede 62 Program Koordinasyon Ofisi masında], Özbekistan, Pakistan, Romanya, Senegal, [Afganistan Kabil, Afganistan Mezar-ı Şerif, Arnavutluk, Sırbistan, Somali, Sudan, Suriye [ülkenin içerisinde bu- Azerbaycan, Bangladeş, Bosna Hersek, Bulgaristan lunduğu özel şartlar sebebiyle hâlihazırda aktif değil], [kurulma aşamasında], Cezayir, Cibuti, Çad, Etiyopya, Tacikistan, Tanzanya, Tunus, Türkmenistan, Uganda, Filipinler, Filistin, Gambiya [kurulma aşamasında],Gine, Ukrayna Kırım, Ukrayna Kiev, Ürdün, Yemen] ve; Dokuz İrtibat Ofisi Filistin Gazze, Yemen Aden, Somali Hargeisa, Libya Bin- Almatı, Afganistan Herat, Pakistan Karaçi, Lübnan Trab- gazi [aktif değil], Sudan Nyala [aktif değil], Kazakistan lus İrtibat Ofisleri bulunmaktadır.";;355;Bulgaristan;;Belirsiz;Drop
TIKAFaaliyet2020Web.pdf;2020;Program Koordinasyon Ofisleri ile İletişim: İNSAN KAYNAKLARI YÖNETİM SİSTEMİ Başkanlığımız Program Koordinasyon Ofisleri ile daha ekonomik, kolay ve güvenli iletişim için 2006 yılında uydu bağ- lantısı üzerinden telefon ve internet projesi başlatılmış olup uydu üzerinden internet sağlanan ofisler şu şekildedir: Afganistan, Arnavutluk, Azerbaycan, Bosna-Hersek, Filistin, Gürcistan, Karadağ, Kazakistan, Kosova, Makedonya, Moldova, Özbekistan, Sudan, Tacikistan, Türkmenistan 10.;;347;Kosova;Ekonomik, Kalkınma, Teknik ve Altyapı Yardımı;Belirsiz;Drop
TIKAFaaliyet2020Web.pdf;2020;Program Koordinasyon Ofisleri ile İletişim: İNSAN KAYNAKLARI YÖNETİM SİSTEMİ Başkanlığımız Program Koordinasyon Ofisleri ile daha ekonomik, kolay ve güvenli iletişim için 2006 yılında uydu bağ- lantısı üzerinden telefon ve internet projesi başlatılmış olup uydu üzerinden internet sağlanan ofisler şu şekildedir: Afganistan, Arnavutluk, Azerbaycan, Bosna-Hersek, Filistin, Gürcistan, Karadağ, Kazakistan, Kosova, Makedonya, Moldova, Özbekistan, Sudan, Tacikistan, Türkmenistan 10.;;343;Makedonya;Ekonomik, Kalkınma, Teknik ve Altyapı Yardımı;Belirsiz;Drop
TIKAFaaliyet2020Web.pdf;2020;42 43 TİKA FAALİYET RAPORU 2020 TİKA FAALİYET RAPORU 2020 Kuzey Makedonya 44 45 TİKA FAALİYET RAPORU 2020 TİKA FAALİYET RAPORU 2020 03 FAALİYETLERE İLİŞKİN BİLGİ VE DEĞERLENDİRMELER A.;;343;Makedonya;;Belirsiz;Drop
TIKAFaaliyet2020Web.pdf;2020;"Kuzey Makedonya Cumhuriyeti'nin Doyran Belediyesi
sınırları içinde, dağlık bir alanda bulunan Gökçeli Yörük
Türk Köyü merkezden 10 km uzaklıkta bulunmaktadır. Yörük
Türklerinin yaşadığı köyde bulunan yeni okul binasının
kapsamlı donatımı Başkanlığımız gerçekleştirilmiştir.
Kuzey Makedonya'da eğitimde eşitlik anlayışından hareketle
her çocuğun eşit eğitim alması için; fiziki altyapıların
güçlendirilmesi ile daha sağlıklı modern eğitim ortamların
oluşturulması amaçlanmıştır.";Tika;343;Makedonya;Eğitim ve Kültürel Yardımlar;Yerel Yönetimler;
TIKAFaaliyet2020Web.pdf;2020;"Kuzey Makedonya –
Anayasa Mahkemesi Toplantı Salonunun Yenilenmesi
Kuzey Makedonya Cumhuriyeti Anayasa Mahkemesi yasaların anayasaya uygunluğunu denetleyen ve toplamda
dokuz üyeden oluşan en üst yargı organıdır. Bahse konu kurumun uluslararası heyetlerin katılımı ile toplantıların ve
önemli görüşmelerin gerçekleştirildiği toplantı salonunun eski ve yıpranmış olduğu, ayrıca salonun mobilya ekipmanı
ile sunum ve tanıtımlarında kullanılacak teknik donanımının yetersiz olmasından dolayı, söz konusu ana salonun
kapsamlı tadilatı ve donanımı Başkanlığımızca gerçekleştirilmiştir.";Tika;343;Makedonya;Ekonomik, Kalkınma, Teknik ve Altyapı Yardımı;Merkezi Hükümet ve Bağlı Aktörler;
TIKAFaaliyet2020Web.pdf;2020;bulunan ve yabancıların kabulü için Azerbaycan'da bulunan yabancıla- DEVLET GÖÇ HİZMETİ MERKEZ OFİSİNİN TADİLAT VE DONANIMI A z e r b a y c a n – D ev let Göç Hiz meti C ez a yi r – Y ü ks e k Ö ğ re t i m Ba ka n l ı ğ ı S a ğ l ı k Bi l i ml e ri A ra ş t ı rma A ja n s ı Afganistan – Kuzey Makedonya – Kütüphane Kurulumu Anayasa Mahkemesi Toplantı Salonunun Yenilenmesi Afganistan kuzeyinde yer alan Cevizcan Vilayeti Şibirgan şehri tarih boyunca kültür ve sanat beşiği olup, şehrin Kuzey Makedonya Cumhuriyeti Anayasa Mahkemesi yasaların anayasaya uygunluğunu denetleyen ve toplamda merkezine daha önce yapımı Başkanlığımız tarafından tamamlanan Ankara Ali Şiir Neva-i Camii'nin yerleşkesinde dokuz üyeden oluşan en üst yargı organıdır.;;343;Makedonya;;Belirsiz;
TIKAFaaliyet2020Web.pdf;2020;"Başkanlığımızın ""Kuzey Makedonya Saglıklı ve Sürdürülebilir
Eğitim Projesi"" çerçevesinde ve Kuzey Makedonya
Çalışma ve Sosyal Politikalar Bakanlığı iş birliğinde
başkent Üsküp'teki Karpoş Belediyesinde bulunan ""Orce
Nikolov"" anaokuluna ve diğer anaokullara dağıtım gerçekleştirilmiştir.
Bu kapsamda Kuzey Makedonya'daki
anaokullarına yeni tip koronavirüs [Kovid-19] salgınıyla
mücadele kapsamında 150 dezenfektan standı ve 100
temassız ateş ölçer desteğinde bulunulmuştur.";Tika;343;Makedonya;İnsani Yardım;Merkezi Hükümet ve Bağlı Aktörler;
TIKAFaaliyet2020Web.pdf;2020;Bu kapsamda Kuzey Makedonya'daki anaokullarına yeni tip koronavirüs [Kovid-19] salgınıyla mücadele kapsamında 150 dezenfektan standı ve 100 temassız ateş ölçer desteğinde bulunulmuştur.;Tika;343;Makedonya;İnsani Yardım, Eğitim ve Kültürel Yardımlar;Belirsiz;Iteration
TikaFaaliyetWeb.pdf;;Program Koordinasyon Ofisleri: Afganistan Kabil, Afganistan Mezar-ı Şerif, Arnavutluk, Azerbaycan, Bangladeş, Bosna Hersek, Cezayir, Cibuti, Çad, Etiyopya, Filipinler, Filistin, Gambiya, Gine, Güney Afrika Cumhuriyeti, Güney Sudan, Gürcistan, Hırvatistan, Irak, İsrail, Kamerun, Karadağ, Kazakistan, Kenya, Kırgızistan, Kolombiya, Komorlar Birliği, Kosova, Libya, Lübnan, Macaristan, Madagaskar, Mali, Makedonya, Meksika, Mısır, Moğolistan, Moldova, Mozambik, Myanmar, Namibya, Nijer, Nijerya, Özbekistan, Pakistan, Romanya, Senegal, Sırbistan, Somali, Sudan, Suriye (ülkenin içerisinde bulunduğu özel şartlar sebebiyle hâlihazırda aktif değil), Tacikistan, Tanzanya, Tunus, Türkmenistan, Uganda, Ukrayna Kırım, Ukrayna Kiev, Ürdün, Yemen.;;347;Kosova;;Belirsiz;Drop
TikaFaaliyetWeb.pdf;;Program Koordinasyon Ofisleri: Afganistan Kabil, Afganistan Mezar-ı Şerif, Arnavutluk, Azerbaycan, Bangladeş, Bosna Hersek, Cezayir, Cibuti, Çad, Etiyopya, Filipinler, Filistin, Gambiya, Gine, Güney Afrika Cumhuriyeti, Güney Sudan, Gürcistan, Hırvatistan, Irak, İsrail, Kamerun, Karadağ, Kazakistan, Kenya, Kırgızistan, Kolombiya, Komorlar Birliği, Kosova, Libya, Lübnan, Macaristan, Madagaskar, Mali, Makedonya, Meksika, Mısır, Moğolistan, Moldova, Mozambik, Myanmar, Namibya, Nijer, Nijerya, Özbekistan, Pakistan, Romanya, Senegal, Sırbistan, Somali, Sudan, Suriye (ülkenin içerisinde bulunduğu özel şartlar sebebiyle hâlihazırda aktif değil), Tacikistan, Tanzanya, Tunus, Türkmenistan, Uganda, Ukrayna Kırım, Ukrayna Kiev, Ürdün, Yemen.;;343;Makedonya;;Belirsiz;Drop
TikaFaaliyetWeb.pdf;;ofisler şu şekildedir: Afganistan, Arnavutluk, Azerbaycan, Bosna-Her- sek, Filistin, Gürcistan, Karadağ, Kazakistan, Kosova, Makedonya, Mol- dova, Özbekistan, Sudan, Tacikistan, Türkmenistan, Kırım.;;347;Kosova;;Belirsiz;Drop
TikaFaaliyetWeb.pdf;;ofisler şu şekildedir: Afganistan, Arnavutluk, Azerbaycan, Bosna-Her- sek, Filistin, Gürcistan, Karadağ, Kazakistan, Kosova, Makedonya, Mol- dova, Özbekistan, Sudan, Tacikistan, Türkmenistan, Kırım.;;343;Makedonya;;Belirsiz;Drop
TikaFaaliyetWeb.pdf;2018;N İ JER Makedonya – Üsküp İsa Bey Medresesi Eğitim ve Yurt Binası Modernizasyonu Üsküp İsa Bey Medresesi’nin dış cephe ve iç mekan duvarlarında su ve kanalizasyon tesisatında yaşanan aksaklıklar nedeniyle ciddi nem problemi yaşandığı, nemden kaynaklı kabarmalar, şişmeler, dağılmalar, cep- hede renk kirliliği, korozyon ve çürümenin olduğu gözlemlenmiştir. Binada yenileme çalışmalarına başlanmış olup çalışmalar halen devam etmektedir.;Tika;343;Makedonya;Eğitim ve Kültürel Yardımlar;Sivil Toplum;
TikaFaaliyetWeb.pdf;2018;"Kosova – Öğrenci Yurdu Modernizasyonu 1960’lı yıllarda inşa edilen yurt; idari bölüm, sosyal alan, mutfak ve yemekhaneyi kapsayan ve yaklaşık 100 üniversite ve lise öğrencisini barındırabilecek iki bloktan oluşmaktadır.";Tika;347;Kosova;İnsani Yardım, Eğitim ve Kültürel Yardımlar;Sivil Toplum;
TikaFaaliyetWeb.pdf;2018;"Makedonya – Uluslararası
Balkan Üniversitesi'ne Destek. Yaklaşık 60 bin m2 kapalı alana sahip üniversite, Türkiye ile Balkanlar arasında eğitim ve kültür köprüsü olma
misyonu ile hareket etmektedir. Destek kapsamında, binanın fiziki altyapısı güçlendirilmiş, bina modern
sistemlerle donatılmıştır.";Tika;343;Makedonya;Eğitim ve Kültürel Yardımlar;Sivil Toplum;
