"","Document","Date","clean_sentence","Source","Recipient_Code","Recipient_Name","aid_type","recipient_type","Note"
"246","TikaRaporları2TurkiyeKalkinma2019Web.pdf","2019","Tüm bu küresel sorunlarla Çeşitli Ülkelerde Tedavi Desteği mücadele etmek adına Sürdürülebilir Kalkınma Amaçları arasına dâhil edilen “SKA 6: Herkes için erişilebilir su ve atıksu hizmetlerini ve sürdürülebilir su yönetimini güvence altına almak” hedefi doğrultusunda ülkemiz; içme Sağlık Bakanlığı tarafından; sağlık alanındaki İkili anlaşmalar kapsamında, 2019 yılında Suriye, Irak, Afganistan, suyu temini, su arıtma tesislerinin kurulumu gibi pek çok proje ile faaliyet gösterdiği coğrafyalarda temiz su temini Sudan, Yemen, Kosova, Azerbaycan, Arnavutluk, Nijer, Kırgızistan başta olmak üzere çeşitli ülke vatandaşların- vasıtasıyla yaşam koşullarının iyileştirilmesi çalışmalarına devam etmektedir.","Tika",347,"Kosova","İnsani Yardım","Merkezi Hükümet ve Bağlı Aktörler",""
"247","TikaRaporları2TurkiyeKalkinma2019Web.pdf","2019","Kuzey Makedonya Cumhuriyeti Dışişleri Bakanlığının teknik altyapısının iyileştirilmesi kapsamında TİKA tarafından dijital arşiv altyapısının kurulumu için gerekli 3 adet masaüstü
bilgisayar, 2 adet renkli çok fonksiyonlu yazıcı, 5 adet tarayıcı, 1 adet arşiv depolama cihazı, 1 adet server ve 1 adet gelişmiş yazılım temin edilmiş ve kurulumu yapılarak gerekli eğitim desteği sağlanmıştır","Tika",343,"Makedonya","Ekonomik, Kalkınma, Teknik ve Altyapı Yardımı","Merkezi Hükümet ve Bağlı Aktörler",""
"248","TikaRaporları2TurkiyeKalkinma2019Web.pdf","2019","GÖREV YAPACAK MILLI SAVUNMA BAKANLIĞI TARAFINDAN: Kosova-Prizren Namazgâh bakım onarım projesi gerçekleştirilmiştir.","Tika",347,"Kosova","Eğitim ve Kültürel Yardımlar","Sivil Toplum",""
"249","TikaRaporları2TurkiyeKalkinma2019Web.pdf","2019","Kosova-Ferizay Deshmoret Koshare İlköğretim Okulu bakım onarım ve malzeme alımı yapılmıştır.","Tika",347,"Kosova","Eğitim ve Kültürel Yardımlar","Yerel Yönetimler",""
"250","TikaRaporları2TurkiyeKalkinma2019Web.pdf","2019","Kuzey Makedonya Sveti Nikole Belediyesinde yapımı planlanan cami inşaatı, Zimbabve’da Gara Warima Waqf Foundation’un [GWWF] yarım halde bulunan cami inşaatları, Ukrayna Kiev Çayki Köyünde yapılmakta olan İslam Kültür Merkezi inşaatına yardım gönderilmiştir.","Tika",343,"Makedonya","Eğitim ve Kültürel Yardımlar","Sivil Toplum",""
"251","TikaRaporları2TurkiyeKalkinma2019Web.pdf","2019","Bulgaristan Madan Bölge Hastanesi için dijital röntgen cihazı alımı yapılmıştır.","Tika",355,"Bulgaristan","İnsani Yardım","Yerel Yönetimler",""
"252","TikaRaporları2TurkiyeKalkinma2019Web.pdf","2019","Zimbabve | 94 TÜRKİYE KALKINMA YARDIMLARI RAPORU | 2019 TÜRKİYE KALKINMA YARDIMLARI RAPORU | 2019 95 VAKIFLAR GENEL MÜDÜRLÜĞÜ TARAFINDAN: Vakfiyelerde yer alan hayır şartlarının yerine getirilmesi amacıyla Bosna-Hersek, Kuzey Kıbrıs Türk Cumhuriyeti, Kuzey Makedonya ve Yemen’de bulunan ihtiyaç sahiplerine gıda yardımları gönderilmiştir.","Tika",343,"Makedonya","İnsani Yardım","Sivil Toplum",""
"253","TikaRaporları2TurkiyeKalkinma2019Web.pdf","2019","KOSOVA VE BOSNA HERSEK’TE Kosova - Priştina Piri Nazır [Pirinaz] Camii, Priştina Alaaddin Bey Camii, Cakova Mahmud Paşa Camii, Surigana Köyü Camii, Cakova Rahaveç Kuran Kursu için restorasyon çalışmaları başlatılmıştır.","Tika",347,"Kosova","Eğitim ve Kültürel Yardımlar","Sivil Toplum",""
"254","TikaRaporları2TurkiyeKalkinma2019Web.pdf","2019","Türk Kızılay, Filistin, Sudan, Endonezya, Sri Lanka, Kırgızistan, Kosova, Somali, Pakistan gibi ülkelerde insani yardım faaliyetlerinin yanı sıra pek çok kalıcı refaha yönelik çalışmalara imza atmaktadır.","Tika",347,"Kosova","İnsani Yardım","Sivil Toplum",""
"255","TikaRaporları2TurkiyeKalkinma2019Web.pdf","2019","SU KUYUSU AÇILMIŞ OLUP Somali | 162 TÜRKİYE KALKINMA YARDIMLARI RAPORU | 2019 TÜRKİYE KALKINMA YARDIMLARI RAPORU | 2019 163 DİĞER SOSYAL ALTYAPI VE HİZMETLER SAĞLIK Afganistan, Bangladeş, Benin, Bosna-Hersek, Burundi, Burkina Faso, Çad, Endonezya, Etiyopya, Fildişi Sahili,Fi- Nijer’de dâhiliye, göz, kadın hastalıkları ve doğum, genel cerrahi, kulak-burun-boğaz, çocuk hastalıkları ve diş lipinler, Filistin, Gana, Kamerun, Kenya, Kosova, Kuzey Makedonya, Lübnan, Mali, Moğolistan, Moritanya, Nijer, branşlarında binlerce kontrol ve tedavi gerçekleştirilmiştir.","Tika",347,"Kosova","İnsani Yardım","Sivil Toplum",""
"256","TikaRaporları2TurkiyeKalkinma2019Web.pdf","2019","SU KUYUSU AÇILMIŞ OLUP Somali | 162 TÜRKİYE KALKINMA YARDIMLARI RAPORU | 2019 TÜRKİYE KALKINMA YARDIMLARI RAPORU | 2019 163 DİĞER SOSYAL ALTYAPI VE HİZMETLER SAĞLIK Afganistan, Bangladeş, Benin, Bosna-Hersek, Burundi, Burkina Faso, Çad, Endonezya, Etiyopya, Fildişi Sahili,Fi- Nijer’de dâhiliye, göz, kadın hastalıkları ve doğum, genel cerrahi, kulak-burun-boğaz, çocuk hastalıkları ve diş lipinler, Filistin, Gana, Kamerun, Kenya, Kosova, Kuzey Makedonya, Lübnan, Mali, Moğolistan, Moritanya, Nijer, branşlarında binlerce kontrol ve tedavi gerçekleştirilmiştir.","Tika",343,"Makedonya","İnsani Yardım","Sivil Toplum",""
"257","TikaRaporları2TurkiyeKalkinma2021Web.pdf","2021","TÜRKIYE'NIN 2021 STK YARDIMLARI [MILYON DOLAR] [MILYON DOLAR] 26 TÜRKİYE KALKINMA YARDIMLARI RAPORU | 2021 TÜRKİYE KALKINMA YARDIMLARI RAPORU | 2021 27 Ülkesel Panorama | 2021 Ülkesel Panorama | 2021 Güney Sahra Bölgesel 0,321 Afganistan 30,836 Afrika Bölgesel 0,76 Ermenistan 0,009 TÜRKİYE İKİ TARAFLI RESMİ KALKINMA YARDIMLARI AMERİKA TOPLAM 19,12 Azerbaycan 44,238 ÜLKESEL PANORAMA Kuzey ve Orta Amerika 16,51 Bangladeş 4,933 Grafik 15: Türkiye İki Taraflı Resmi Kalkınma Yardımları Ülkesel Panorama [2021; Milyon Dolar] Küba 0,012 Gürcistan 2,932 AVRUPA TOPLAM 85,89 Mali 0,595 Dominik Cumhuriyeti 0,007 Hindistan 0,891 Arnavutluk 3,953 Moritanya 0,421 Haiti 0,549 Kazakistan 24,136 Beyaz Rusya 0,055 Nijer 1,447 Jamaika 0,006 Kırgız Cumhuriyeti 19,288 Bosna-Hersek 8,643 Nijerya 0,771 Saint Lucia 0,001 Maldivler 0,008 Kosova 4,941 Senegal 0,842 Saint Vincent ve Grenadinler 0,020 Myanmar 0,271 Moldova 3,481 Sierra Leone 0,299 Kosta Rika 0,036 Nepal 0,161 Karadağ 0,939 Togo 0,361 El Salvador 0,015 Pakistan 2,986 Kuzey Makedonya 4,496 Burundi 0,364 Guatemala 0,011 Sri Lanka 0,221 Sırbistan 1,049 Komor Adaları 0,230 Honduras 0,005 Tacikistan 1,863 Ukrayna 1,241 Cibuti 0,743 Meksika 0,632 Türkmenistan 0,542 Avrupa Bölgesel 57,089 Eritre 0,108 Karayipler ve Orta Amerika Bölgesel 15,217 Özbekistan 3,790 AFRİKA TOPLAM 99,10 Etiyopya 1,452 Amerika Bölgesel 0,18 Orta Asya Bölgesel 1,119 Kuzey Sahra 17,46 Kenya 0,822 Güney Amerika 2,43 Güney Asya Bölgesel 0,100 Cezayir 1,519 Madagaskar 0,243 Arjantin 0,211 Güney ve Orta Asya Bölgesel 0,013 Mısır 2,078 Malavi 0,136 Bolivya 0,027 Uzak Doğu 7,03 Libya 11,694 Mauritius 0,037 Brezilya 0,027 Endonezya 1,522 Fas 0,700 Mozambik 0,208 Kolombiya 1,298 Çin Halk Cumhuriyeti 0,670 Tunus 1,451 Ruanda 0,612 Ekvador 0,205 Kamboçya 0,117 Kuzey Sahra Bölgesel 0,022 Somali 51,796 Guyana 0,015 Laos 0,040 Güney Sahra 80,87 Güney Sudan 0,682 Paraguay 0,049 Malezya 0,606 Botsvana 0,068 Sudan 3,356 Peru 0,169 Moğolistan 2,316 Svaziland 0,057 Tanzanya 1,154 Surinam 0,011 Filipinler 0,268 Lesotho 0,375 Uganda 0,660 Venezuela 0,297 Tayland 0,324 Namibya 0,160 Zambiya 0,380 Güney Amerika Bölgesel 0,125 Doğu Timor 0,002 Güney Afrika Cumhuriyeti 0,389 Zimbabve 0,527 ASYA TOPLAM 6.939,62 Vietnam 0,050 Benin 0,396 Angola 0,217 Orta Doğu 6.794,07 Uzak Doğu Bölgesel 1,119 Burkina Faso 0,338 Kamerun 0,847 İran 1,750 Asya Bölgesel 0,18 Orta Afrika Cumhuriyeti 0,098 Irak 32,951 OKYANUSYA TOPLAM 0,61 Kabo Verde Cumhuriyeti /Yeşil Burun 0,002 Çad 1,197 Ürdün 2,897 Fiji 0,010 Fildişi Sahili 0,271 Kongo 0,262 Lübnan 2,207 Papua Yeni Gine 0,005 Gambiya 4,014 Kongo Demokratik Cumhuriyeti 0,355 Suriye 6.689,830 Samoa 0,001 Gana 0,633 Ekvator Ginesi 0,141 Filistin 33,945 Okyanusya Bölgesel 0,598 Gine 1,680 Gabon 0,062 Yemen 3,891 BÖLGELERE AYRIŞTIRILAMAYAN 483,66 Gine Bissau 0,583 Liberya 0,151 Sao Tome ve Principe 0,009 Orta Doğu Bölgesel 26,596 Orta ve Güney Asya 138,34 DÜNYA TOPLAMI 7.627,99 28 TÜRKİYE KALKINMA YARDIMLARI RAPORU | 2021 TÜRKİYE KALKINMA YARDIMLARI RAPORU | 2021 29 BM 2015-2030 Sürdürülebilir Kalkınma Amaçları BM 2015-2030 Sürdürülebilir Kalkınma Amaçları SÜRDÜRÜLEBİLİR SKA 1: YOKSULLUĞA SON SKA 2: AÇLIĞA SON SKA 3: SAĞLIKLI VE KALITELI YAŞAM SKA 4: NITELIKLI EĞITIM KALKINMA AMAÇLARI SKA 5: SKA 6: SKA 7: SKA 8: TOPLUMSAL TEMIZ SU VE ERIŞILEBILIR VE TEMIZ İNSANA YAKIŞIR İŞ VE CINSIYET EŞITLIĞI SANITASYON ENERJI EKONOMIK BÜYÜME SKA 9: SKA 10: SKA 11: SKA 12: SANAYI, YENILIKÇILIK EŞITSIZLIKLERIN SÜRDÜRÜLEBILIR SORUMLU ÜRETIM VE VE ALTYAPI AZALTILMASI ŞEHIRLER VE TÜKETIM TOPLULUKLAR SKA 13: SKA 14: SKA 15: SKA 16: İKLIM EYLEMI SUDAKI YAŞAM KARASAL YAŞAM BARIŞ, ADALET VE GÜÇLÜ KURUMLAR SKA 17: AMAÇLAR İÇIN ORTAKLIKLAR 30 TÜRKİYE KALKINMA YARDIMLARI RAPORU | 2021 TÜRKİYE KALKINMA YARDIMLARI RAPORU | 2021 31 BM 2015-2030 Sürdürülebilir Kalkınma Amaçları BM 2015-2030 Sürdürülebilir Kalkınma Amaçları Sosyal, çevresel ve ekonomik boyutlarıyla ele alınan sürdürülebilir kalkınma kavrayışının etme, eşitsizlikleri azaltma ve ekonomilerin refahına katkıda bulunma şeklimizde olumlu temelinde günümüz kuşağının ihtiyaçlarının gelecek kuşakların ihtiyaçlarını karşılayabilme bir etkiye sahip olan, iklim değişikliği tehdidine karşı sürdürülebilir bir şekilde yanıt vermek olanağından ödün vermeksizin karşılanması yatmaktadır.1 İlk defa 1972'de İsveç'in Sto- için evrensel bir eylem çağrısıdır.","Tika",347,"Kosova","Ekonomik, Kalkınma, Teknik ve Altyapı Yardımı","Merkezi Hükümet ve Bağlı Aktörler",""
"258","TikaRaporları2TurkiyeKalkinma2021Web.pdf","2021","TÜRKIYE'NIN 2021 STK YARDIMLARI [MILYON DOLAR] [MILYON DOLAR] 26 TÜRKİYE KALKINMA YARDIMLARI RAPORU | 2021 TÜRKİYE KALKINMA YARDIMLARI RAPORU | 2021 27 Ülkesel Panorama | 2021 Ülkesel Panorama | 2021 Güney Sahra Bölgesel 0,321 Afganistan 30,836 Afrika Bölgesel 0,76 Ermenistan 0,009 TÜRKİYE İKİ TARAFLI RESMİ KALKINMA YARDIMLARI AMERİKA TOPLAM 19,12 Azerbaycan 44,238 ÜLKESEL PANORAMA Kuzey ve Orta Amerika 16,51 Bangladeş 4,933 Grafik 15: Türkiye İki Taraflı Resmi Kalkınma Yardımları Ülkesel Panorama [2021; Milyon Dolar] Küba 0,012 Gürcistan 2,932 AVRUPA TOPLAM 85,89 Mali 0,595 Dominik Cumhuriyeti 0,007 Hindistan 0,891 Arnavutluk 3,953 Moritanya 0,421 Haiti 0,549 Kazakistan 24,136 Beyaz Rusya 0,055 Nijer 1,447 Jamaika 0,006 Kırgız Cumhuriyeti 19,288 Bosna-Hersek 8,643 Nijerya 0,771 Saint Lucia 0,001 Maldivler 0,008 Kosova 4,941 Senegal 0,842 Saint Vincent ve Grenadinler 0,020 Myanmar 0,271 Moldova 3,481 Sierra Leone 0,299 Kosta Rika 0,036 Nepal 0,161 Karadağ 0,939 Togo 0,361 El Salvador 0,015 Pakistan 2,986 Kuzey Makedonya 4,496 Burundi 0,364 Guatemala 0,011 Sri Lanka 0,221 Sırbistan 1,049 Komor Adaları 0,230 Honduras 0,005 Tacikistan 1,863 Ukrayna 1,241 Cibuti 0,743 Meksika 0,632 Türkmenistan 0,542 Avrupa Bölgesel 57,089 Eritre 0,108 Karayipler ve Orta Amerika Bölgesel 15,217 Özbekistan 3,790 AFRİKA TOPLAM 99,10 Etiyopya 1,452 Amerika Bölgesel 0,18 Orta Asya Bölgesel 1,119 Kuzey Sahra 17,46 Kenya 0,822 Güney Amerika 2,43 Güney Asya Bölgesel 0,100 Cezayir 1,519 Madagaskar 0,243 Arjantin 0,211 Güney ve Orta Asya Bölgesel 0,013 Mısır 2,078 Malavi 0,136 Bolivya 0,027 Uzak Doğu 7,03 Libya 11,694 Mauritius 0,037 Brezilya 0,027 Endonezya 1,522 Fas 0,700 Mozambik 0,208 Kolombiya 1,298 Çin Halk Cumhuriyeti 0,670 Tunus 1,451 Ruanda 0,612 Ekvador 0,205 Kamboçya 0,117 Kuzey Sahra Bölgesel 0,022 Somali 51,796 Guyana 0,015 Laos 0,040 Güney Sahra 80,87 Güney Sudan 0,682 Paraguay 0,049 Malezya 0,606 Botsvana 0,068 Sudan 3,356 Peru 0,169 Moğolistan 2,316 Svaziland 0,057 Tanzanya 1,154 Surinam 0,011 Filipinler 0,268 Lesotho 0,375 Uganda 0,660 Venezuela 0,297 Tayland 0,324 Namibya 0,160 Zambiya 0,380 Güney Amerika Bölgesel 0,125 Doğu Timor 0,002 Güney Afrika Cumhuriyeti 0,389 Zimbabve 0,527 ASYA TOPLAM 6.939,62 Vietnam 0,050 Benin 0,396 Angola 0,217 Orta Doğu 6.794,07 Uzak Doğu Bölgesel 1,119 Burkina Faso 0,338 Kamerun 0,847 İran 1,750 Asya Bölgesel 0,18 Orta Afrika Cumhuriyeti 0,098 Irak 32,951 OKYANUSYA TOPLAM 0,61 Kabo Verde Cumhuriyeti /Yeşil Burun 0,002 Çad 1,197 Ürdün 2,897 Fiji 0,010 Fildişi Sahili 0,271 Kongo 0,262 Lübnan 2,207 Papua Yeni Gine 0,005 Gambiya 4,014 Kongo Demokratik Cumhuriyeti 0,355 Suriye 6.689,830 Samoa 0,001 Gana 0,633 Ekvator Ginesi 0,141 Filistin 33,945 Okyanusya Bölgesel 0,598 Gine 1,680 Gabon 0,062 Yemen 3,891 BÖLGELERE AYRIŞTIRILAMAYAN 483,66 Gine Bissau 0,583 Liberya 0,151 Sao Tome ve Principe 0,009 Orta Doğu Bölgesel 26,596 Orta ve Güney Asya 138,34 DÜNYA TOPLAMI 7.627,99 28 TÜRKİYE KALKINMA YARDIMLARI RAPORU | 2021 TÜRKİYE KALKINMA YARDIMLARI RAPORU | 2021 29 BM 2015-2030 Sürdürülebilir Kalkınma Amaçları BM 2015-2030 Sürdürülebilir Kalkınma Amaçları SÜRDÜRÜLEBİLİR SKA 1: YOKSULLUĞA SON SKA 2: AÇLIĞA SON SKA 3: SAĞLIKLI VE KALITELI YAŞAM SKA 4: NITELIKLI EĞITIM KALKINMA AMAÇLARI SKA 5: SKA 6: SKA 7: SKA 8: TOPLUMSAL TEMIZ SU VE ERIŞILEBILIR VE TEMIZ İNSANA YAKIŞIR İŞ VE CINSIYET EŞITLIĞI SANITASYON ENERJI EKONOMIK BÜYÜME SKA 9: SKA 10: SKA 11: SKA 12: SANAYI, YENILIKÇILIK EŞITSIZLIKLERIN SÜRDÜRÜLEBILIR SORUMLU ÜRETIM VE VE ALTYAPI AZALTILMASI ŞEHIRLER VE TÜKETIM TOPLULUKLAR SKA 13: SKA 14: SKA 15: SKA 16: İKLIM EYLEMI SUDAKI YAŞAM KARASAL YAŞAM BARIŞ, ADALET VE GÜÇLÜ KURUMLAR SKA 17: AMAÇLAR İÇIN ORTAKLIKLAR 30 TÜRKİYE KALKINMA YARDIMLARI RAPORU | 2021 TÜRKİYE KALKINMA YARDIMLARI RAPORU | 2021 31 BM 2015-2030 Sürdürülebilir Kalkınma Amaçları BM 2015-2030 Sürdürülebilir Kalkınma Amaçları Sosyal, çevresel ve ekonomik boyutlarıyla ele alınan sürdürülebilir kalkınma kavrayışının etme, eşitsizlikleri azaltma ve ekonomilerin refahına katkıda bulunma şeklimizde olumlu temelinde günümüz kuşağının ihtiyaçlarının gelecek kuşakların ihtiyaçlarını karşılayabilme bir etkiye sahip olan, iklim değişikliği tehdidine karşı sürdürülebilir bir şekilde yanıt vermek olanağından ödün vermeksizin karşılanması yatmaktadır.1 İlk defa 1972'de İsveç'in Sto- için evrensel bir eylem çağrısıdır.","Tika",343,"Makedonya","Ekonomik, Kalkınma, Teknik ve Altyapı Yardımı","Merkezi Hükümet ve Bağlı Aktörler",""
"259","TikaRaporları2TurkiyeKalkinma2021Web.pdf","2021","46 TÜRKİYE KALKINMA YARDIMLARI RAPORU | 2021 TÜRKİYE KALKINMA YARDIMLARI RAPORU | 2021 47 Sürdürülebilir Kalkınma Amaçları 2 Sürdürülebilir Kalkınma Amaçları 2 Kosova – Gürcistan – Kırsal Kalkınma Yatırımlarının Desteklenmesi Programı - Keçi Sütü Üretimi ve Ahıskalı Çiftçilerin Tarımsal Üretiminin Desteklenmesi Ürünlerinin Desteklenmesi Projesi TİKA, 1944 yılında sürgüne maruz kalmış ve Kırsal Kalkınma Yatırımlarının Desteklenmesi son yıllarda ana vatanlarına geri dönen Ahıs- Programı kapsamında gerçekleştirilen ""Keçi kalı Türklerin yerel topluma entegrasyonu ve Sütü Üretimi ve Ürünlerinin Desteklenmesi"" ekonomik durumlarının iyileştirilmesi amacıy- projesi ile Viti Belediyesi'nin Goşica köyün- la projeler gerçekleştirmeye devam etmekte- de yer alan ve 17 kadın üyesi ile keçi sütü dir.","Tika ",347,"Kosova","Ekonomik, Kalkınma, Teknik ve Altyapı Yardımı","Yerel Yönetimler",""
"260","TikaRaporları2TurkiyeKalkinma2021Web.pdf","2021","100 200 Pakistan’ın Farklı Temin Edilen Peşaver Ravlakot Şehirlerden Eğitim Türki Tipi Arı Verilen Uzman Kovanı Kohat İslamabad Sayısı Sayısı Gujarat 100 Temin Edilen Arıcılık Eğitim Kiti Sayısı 25 20 25 525 İstihdam ve Gelir Yaşam Standartlarının Romit Gaziler ve Toplamda Sağlanan Kaynağı İmkânı Sağlanan Arttırılması Amacıyla Emekliler Rehabilitasyon Arı Kovanı ve Aile Sayısı Temin Edilen Merkezine Temin Diğer Ekipmanların Kovan Sayısı Edilen Kovan Sayısı Sayısı 50 TÜRKİYE KALKINMA YARDIMLARI RAPORU | 2021 TÜRKİYE KALKINMA YARDIMLARI RAPORU | 2021 51 Sürdürülebilir Kalkınma Amaçları 2 Sürdürülebilir Kalkınma Amaçları 2 Kuzey Makedonya – Çilek Yetiştiriciliği Projesi Kuzey Makedonya'da altı farklı bölgede [Vasilevo (Yeni Mahale köyü), Bosilovo (Ernekök köyü), Konçe, Lozova (Dorfulu köyü), Gradsko (Koçuli köyü) ve Ohri Belediyeleri sınırları için- de] tespit edilen toplam 20 aileye, yıl boyunca verimi yüksek olan çilek yetiştiriciliği için ge- rekli tarım ekipmanları ve çilek fide desteği TİKA tarafından sağlanmıştır.","Tika ",343,"Makedonya","Ekonomik, Kalkınma, Teknik ve Altyapı Yardımı","Yerel Yönetimler",""
"261","TikaRaporları2TurkiyeKalkinma2021Web.pdf","2021","Kuzey Makedonya – Nijer – Aziz Panteleymon Diş Hekimliği Fakültesi Kliniğinin Onarım, 27.","Tika",343,"Makedonya","Ekonomik, Kalkınma, Teknik ve Altyapı Yardımı","Sivil Toplum",""
"262","TikaRaporları2TurkiyeKalkinma2021Web.pdf","2021","243 414 5 Sudan ve Türkiye’de Türk-Sudan Uluslararası Tatbikat Düzenlenen 8 Ayrı Eğitime İşbirliği İçerisinde Programı Kapsamında Katılan Personel Yapılan Eğitimlere Uygulanan Acil Sayısı Katılan Personel Sayısı Durum Senaryosu Sayısı 62 TÜRKİYE KALKINMA YARDIMLARI RAPORU | 2021 TÜRKİYE KALKINMA YARDIMLARI RAPORU | 2021 63 Sürdürülebilir Sürdürülebilir Kalkınma AmaçlarıKalkınma Amaçları 2 Projeleri, Seracılık 3 Sürdürülebilir Kalkınma Amaçları 3 Kuzey Makedonya – Mobil Klinik ve Sağlık Taraması Projesi Aziz Kiril ve Metodiy Üniversitesi Göğüs Hastalıkları bölümü iş birliğinde, genel sağlık tara- ması yapılabilmesi için teknik ekipman desteğinde bulunulmuştur.","Tika ",343,"Makedonya","İnsani Yardım","Yerel Yönetimler",""
"263","TikaRaporları2TurkiyeKalkinma2021Web.pdf","2021","Etkin- likte Batı Trakya, Kuzey Makedonya, Kosova ve Sırbistan'dan kadınlar bir araya getirilmiş, çeşitli alanlarda başarılı 15 kadının hayat hikâyeleri paylaşılmış ve bu hayat hikâyeleri daha sonra kitap haline getirilmiştir.","Tika",347,"Kosova","Eğitim ve Kültürel Yardımlar","Sivil Toplum",""
"264","TikaRaporları2TurkiyeKalkinma2021Web.pdf","2021","Etkin- likte Batı Trakya, Kuzey Makedonya, Kosova ve Sırbistan'dan kadınlar bir araya getirilmiş, çeşitli alanlarda başarılı 15 kadının hayat hikâyeleri paylaşılmış ve bu hayat hikâyeleri daha sonra kitap haline getirilmiştir.","Tika",343,"Makedonya","Eğitim ve Kültürel Yardımlar","Sivil Toplum",""
"265","TikaRaporları2TurkiyeKalkinma2021Web.pdf","2021","Gine Milli Savunma Bakanlığının 12 Personeline Kontrol (Boarding) Tim, Cankurtaran ve Kuzey Makedonya – İlk Yardım, Denizde Arama Kurtarma, TİM Eğitimleri, MTV Stüdyo Kurulumu ve Teknik Donanım ve Yazılım Desteği Projesi 3.","Tika ",343,"Makedonya","Ekonomik, Kalkınma, Teknik ve Altyapı Yardımı","Merkezi Hükümet ve Bağlı Aktörler",""
"266","TikaRaporları2TurkiyeKalkinma2021Web.pdf","2021","Kuzey Makedonya Afganistan Kazakistan Ruanda Cumhuriyeti İhtiyaç sahibi ailelere gıda paketi desteği Zorunlu göçlerle yeni sığınma yerlerinde Türk-Kazak Üniversitesinde eğitim gören 2021 yılı Ramazan ayında Ruanda’da sağlanarak, yaşam standartlarının yaşam mücadelesi veren 1.500 aileye acil 700 öğrenciye kumanya, köylerdeki 500 ihtiyaç sahibi 1.000 aileye gıda yardımı artırılması hedeﬂenmiştir.","Tika",343,"Makedonya","İnsani Yardım","Sivil Toplum",""
"267","TikaRaporları2TurkiyeKalkinma2021Web.pdf","2021","Proje ile Filistinlilerin Uzun Sağlanan Tohumluk Buğday Tonu Vadede Gelir Getirici Ürüne Sahip Olmaları Amaçlanmaktadır EĞİTİM 100 20 Bir Türk STK'sı Suriye'de 1.200 Çeşitli Seviyede Eğitim Veren Kurumların Öğrencinin Eğitim Aldığı Okula Öğretmen Ücretleri, Öğrenci Gıda ve Sağladığı Sıra, Dizüstü Bilgisayar ve Barınma Giderleri ile Diğer Giderleri Bir Projeksiyon Makineleri Sayısı Türk STK'sı Tarafından Karşılanan Ülke Sayısı Bir Türk STK’sı Makedonya’da eğitim veren bir okulun yurt binasının inşasını gerçekleştirmiştir.","Tika",343,"Makedonya","Eğitim ve Kültürel Yardımlar","Sivil Toplum",""
"268","2015-faaliyet-raporu.pdf","2015","Proje kapsamında Türkiye’de Tekirdağ, Kırklareli, Edirne; Yurt dışında Ko s ov a 35 ise Makedonya, Yunanistan, Arnavutluk, Kosova, Romanya ve Yugoslavya olmak üzere 9 para vakfında 2015 yılı sonu itibariyle 648 belgenin tespiti yapılmıştır.","Yee",347,"Kosova","Eğitim ve Kültürel Yardımlar","Sivil Toplum",""
"269","2015-faaliyet-raporu.pdf","2015","Proje kapsamında Türkiye’de Tekirdağ, Kırklareli, Edirne; Yurt dışında Ko s ov a 35 ise Makedonya, Yunanistan, Arnavutluk, Kosova, Romanya ve Yugoslavya olmak üzere 9 para vakfında 2015 yılı sonu itibariyle 648 belgenin tespiti yapılmıştır.","Yee",350,"Yunanistan","Eğitim ve Kültürel Yardımlar","Sivil Toplum",""
"270","2015-faaliyet-raporu.pdf","2015","Proje kapsamında Türkiye’de Tekirdağ, Kırklareli, Edirne; Yurt dışında Ko s ov a 35 ise Makedonya, Yunanistan, Arnavutluk, Kosova, Romanya ve Yugoslavya olmak üzere 9 para vakfında 2015 yılı sonu itibariyle 648 belgenin tespiti yapılmıştır.","Yee",343,"Makedonya","Eğitim ve Kültürel Yardımlar","Sivil Toplum",""
"271","2015-faaliyet-raporu.pdf","2015","Balkanlarda Kültürel Mirasın Yeniden İnşası Projesi 100 TÜRKİYE KÜTÜPHANESİ kapsamında 2012 yılından bu yana Bosna Hersek, Makedonya, Hırvatistan ve Kosova’da PROJESİ bulunan Osmanlı Türkçesi, Arapça ve Farsça yaklaşık 10.000 yazma eser, 5.000 matbu T.C.","Yee",347,"Kosova","Eğitim ve Kültürel Yardımlar","Sivil Toplum",""
"272","2015-faaliyet-raporu.pdf","2015","Balkanlarda Kültürel Mirasın Yeniden İnşası Projesi 100 TÜRKİYE KÜTÜPHANESİ kapsamında 2012 yılından bu yana Bosna Hersek, Makedonya, Hırvatistan ve Kosova’da PROJESİ bulunan Osmanlı Türkçesi, Arapça ve Farsça yaklaşık 10.000 yazma eser, 5.000 matbu T.C.","Yee",343,"Makedonya","Eğitim ve Kültürel Yardımlar","Sivil Toplum",""
"273","2015-faaliyet-raporu.pdf","2015","Makedonya’da 4106 el yazması Osmanlı Türkçesi, Arapça ve Farsça eser.","Yee",343,"Makedonya","Eğitim ve Kültürel Yardımlar","Sivil Toplum",""
"274","2015-faaliyet-raporu.pdf","2015","Kosova’da 1167 el yazması Osmanlı Türkçesi, Arapça ve Farsça eser.","Yee",347,"Kosova","Eğitim ve Kültürel Yardımlar","Sivil Toplum",""
"275","2015-faaliyet-raporu.pdf","2015","(MEB ALMANYA) • 9-10 Haziran 2015 tarihinde Kosova’nın Priştine ve Prizren şehirlerinde; 12 Haziran Millî Eğitim Bakanlığı ile işbirliği yapılarak 7 Şubat 2015 tarihinde Makedonya’nın Üsküp 2015 tarihinde Almanya-Berlin’de A1, A2 ve B1 şehrinde Kastamonu Üniversitesi Yabancı düzeylerinde Türkçe sertifika sınavı uygulanmıştır.","Yee",347,"Kosova","Eğitim ve Kültürel Yardımlar","Sivil Toplum",""
"276","2015-faaliyet-raporu.pdf","2015","(MEB ALMANYA) • 9-10 Haziran 2015 tarihinde Kosova’nın Priştine ve Prizren şehirlerinde; 12 Haziran Millî Eğitim Bakanlığı ile işbirliği yapılarak 7 Şubat 2015 tarihinde Makedonya’nın Üsküp 2015 tarihinde Almanya-Berlin’de A1, A2 ve B1 şehrinde Kastamonu Üniversitesi Yabancı düzeylerinde Türkçe sertifika sınavı uygulanmıştır.","Yee",343,"Makedonya","Eğitim ve Kültürel Yardımlar","Sivil Toplum",""
"277","2016-faaliyet-raporu.pdf","2016","İpek’te Kosova’nın Sesleri Türk Müziği Konseri Gerçekleşti İpek Yunus Emre Enstitüsü, 19 Aralık 2015 tarihinde, İpek İstref Begolli Tiyat- rosunda “Kosova’nın Sesleri Türk Müziği” adlı konser düzenledi.","Yee",347,"Kosova","Eğitim ve Kültürel Yardımlar","Sivil Toplum",""
"278","2016-faaliyet-raporu.pdf","2016","Konserde, Priştine Radyosunda kaydı bulunan Sevim Baki Bërveniku, Zeki Sadık, Rehyan Kantarcı, Cengiz Sungur, Güler Grozda, Sebaydin Feyzullah gibi Kosova ve Makedonya’dan Türk müziğinin tanınan isimleri de yer aldı.","Yee",343,"Makedonya","Eğitim ve Kültürel Yardımlar","Sivil Toplum",""
"279","2016-faaliyet-raporu.pdf","2016","51 2016 FAALİYET RAPORU PRIŞTINE YUNUS EMRE ENSTITÜSÜ Kosova’da Halı Dokuma ve Tel Kırma Kursları T.C.","Yee",347,"Kosova","Eğitim ve Kültürel Yardımlar","Sivil Toplum",""
"280","2016-faaliyet-raporu.pdf","2016","Kosova’da Türk Caz Rüzgârı Yunus Emre Enstitüsünün organizas- yonuyla beşincisi düzenlenen Türk Caz Haftası, 12-16 Nisan 2016 tarihlerinde, Kosova’nın Priştine ve Yakova şehirlerin- de gerçekleştirildi.","Yee",347,"Kosova","Eğitim ve Kültürel Yardımlar","Sivil Toplum",""
"281","2016-faaliyet-raporu.pdf","2016","Priştine’de Kadınlar Günü Konseri Priştine Yunus Emre Enstitüsü, 7 Mart Kosova Öğretmenler Günü ile 8 Mart Dünya Kadınlar Günü dolayısıyla, 7 Mart Pazartesi akşamı “Kosova’nın Sesleri” ko- rosu tarafından verilen bir konsere ev sa- hipliği yaptı.","Yee",347,"Kosova","Eğitim ve Kültürel Yardımlar","Sivil Toplum",""
